{
  "cooldown_ticks": 600,
  "name": "Stand on iron",
  "reward_points": 200,
  "tasks": [
    {
      "conditions": {
        "player": [
          {
            "condition": "minecraft:entity_properties",
            "entity": "this",
            "predicate": {
              "stepping_on": {
                "block": {
                  "blocks": "minecraft:iron_block"
                }
              }
            }
          }
        ]
      },
      "count": 600,
      "description": "Stand on iron",
      "id": "stand",
      "trigger": "minecraft:tick"
    }
  ]
}