{
  "cooldown_ticks": 2000,
  "name": "Breed",
  "reward_points": 20,
  "tasks": [
    {
      "conditions": {
        "parent": [
          {
            "condition": "minecraft:entity_properties",
            "entity": "this",
            "predicate": {
              "type": [
                "minecraft:cow",
                "minecraft:pig",
                "minecraft:sheep",
                "minecraft:chicken"
              ]
            }
          }
        ]
      },
      "count": 4,
      "description": "Breed animals",
      "id": "breed",
      "trigger": "minecraft:bred_animals"
    }
  ]
}